raw_id,sqn,brand,brand_detected,product_manufacturer,weight,fat,pack,pfqn
242467,лапша куриная,Роллтон,True,ВСПЕНЕННЫЙ ПОЛИСТИРОЛ,65г,,стакан,Лапша Роллтон Куриная стакан 65г
193849,торт миндальный карамель и земляной орех,Альмонди,True,Almondy AB,450г,,,Торт миндальный Карамель и Земляной орех 450г Альмонди
134301,морс брусничный,О'КЕЙ,True,"Краснодарский филиал ООО ""Томат актив""",1л,,,Морс ОКЕЙ брусничный 1л
311453,вода мин негаз природ,Архыз,True,"ЗАО ""Висма""",1.5л,,пэт,Вода Архыз мин.негаз.природ.1.5л ПЭТ
108575,жульен с белыми грибами и шампиньонами,Не Бренд,True,"OOO ""TPK ""VILON""",2х135г,,,Жульен с белыми грибами и шампиньонами 2х135г Сытоедов
154017,напиток иммуно сокосодерж функц,FITOGU.RU,True,"ЗАО ""Стимул""",0.28л,,ст/б,Напиток ФитоГуру Иммуно сокосодерж.функц.0.28л ст/б
110294,смесь салатная танго микс,Не Бренд,True,,75г,,уп,"Смесь салатная Танго Микс ""Белая Дача"" 75г, уп"
56067,голень цыпленка зам,Ярославский Бройлер,True,"ООО ""Ярославский Бройлер"", Россия",кг,,,Голень цыпленка зам. Ярославский Бройлер. кг
66375,сыр плавленый ветчина,Hochland,True,"ООО ""ХОХЛАНД РУССЛАНД""",140г,,круг,Сыр плавленый HOCHLAND Ветчина 140г круг
199919,сыр салакис,PRESIDENT,True,Somboled d. o. o,250 г,45%,,Сыр салакис Президент 250 г 45%
195308,шоколад молочный пористый,Воздушный,True,"ООО ""Крафт Фудз Рус""",95г,,,Шоколад Воздушный молочный пористый 95г
145285,напиток к/м тан негаз,Bio Баланс,True,"ОАО ""Компания ЮНИМИЛК""",930г,1.9%,,Напиток к/м Тан негаз Bio Баланс 1.9% 930г
123849,икра из кабачков цукини,Огородников,True,"ООО ПК ""Сарепта-ПомидорПром""",490г,,ст/б,Икра из кабачков Цукини Огородников ст/б 490г
245199,мармелад абрикос земляника дыня яблоко,Alela,True,"ООО ""Кондитерская фабрика ""Алела""",270г,,,Мармелад Алела абрикос. земляника. дыня. яблоко 270г
155837,коктейль из орехов и сухофруктов,О'КЕЙ,True,"ЗАО ""ОРЕХПРОМ""",300г,,,Коктейль из орехов и сухофруктов ОКЕЙ 300г
43480,буженина запеченная,СЕТУНЬ,True,"ООО ""МПЗ ""Метунь""",кг,,в/у,Буженина запеченная в/у Сетунь. кг
201128,батончик мюсли яблоко,FIT,True,"""USOVSKO FOOD a.s.""",30г,,,Батончик мюсли Фит Яблоко 30г
177987,мороженое пломбир ванильный,Окей,True,"ООО ""Талосто-3000""",450г,,,Мороженое ОКЕЙ пломбир ванильный 450г
92682,фасоль стручковая,Не Бренд,True,"ООО ""Морозко""",400г,,,Фасоль стручковая Морозко Green 400г
612860,сыр брынза сербский,TM Mlekara Subotica,True,,250 г,45 %,,Сыр Брынза сербский  Mlekara Subotica 45 % 250 г
120635,сыр плавленный сливочный,Rokler,True,ООО Ястро,200г,,ванночка,Сыр плавленный Rokler Сливочный 200г  ванночка
594449,осетр ломтики г/к,Северная компания,True,"ЗАО ""ИТА Северная Компания""",150г,,в/у,Осетр Северная компания ломтики г/к 150г в/у
84654,напиток б/алк негаз сокосод с кусоч винограда,Фрутинг,True,"""A-One International Co., Ltd""","0,238л",,,"Напиток Фрутинг б/алк  негаз сокосод с кусоч винограда 0,238л"
243305,продукт молокосодержащий с сахаром fp,Не Бренд,,"ЗАО ""Алексеевский молочноконсервный комбинат""",270г,8.5%,,Продукт молокосодержащий с сахаром 8.5% 270г FP
141268,конфеты аленка,Красный октябрь,,"ОАО ""Красный Октябрь""",250г,,,Конфеты Аленка 250г
193859,сахар темный тростниковый демерара,Дан Зуккер,True,"Nordic Sugar A.S., Дания",500г,,,Сахар Дан Зуккер темный тростниковый Демерара 500г
263228,сок active яблоко с мякотью,Тонус,True,"ООО ""Лебедянский""",1.45л,,т/пак,Сок Тонус Active+ яблоко с мякотью 1.45л т/пак
73499,кофе раств,Tchibo,True,"""Tchibo Manufacturing Poland Sp.z.o.o."", Польша",95г,,ст/б,Кофе Чибо Эксклюзив Интенс раств. 95г ст/б
81327,коктейль из морепрепродуктов в масле с пряностями,Меридиан,True,"ОАО ПКП ""Меридиан"", Россия",200г,,в/у,Коктейль из морепрепродуктов Меридиан в масле с пряностями 200г в/у
241465,сыр творожный с белыми грибами,Almette,True,"ООО ""ХОХЛАНД РУССЛАНД""",150г,,,Сыр творожный Альметте с белыми грибами 150г
180816,сироп льежский груша яблоко финик,Martine Meurens,,"""Meurens & Rodrigues SPRL""",340г,,,Сироп Льежский (груша.яблоко.финик) 340г
52011,перец красный,Не Бренд,,,кг,,,"Перец красный, кг"
132939,финики,PL NoName,True,"ООО ""Интелл""",300г,,,Финики 300г PL FP
194986,кофе растворимый приват ст,Bushido,True,Haco LTD.,100г,,,Кофе растворимый Эгоист Приват 100г ст
244048,колбаса в/к сервелат ореховый,РЕМИТ,True,"ООО ""МПЗ Ремит""",кг,,в/у,Колбаса в/к Сервелат Ореховый в/у РЕМИТ. кг
195181,шоколад молочный максфанарахис/драже/карамель,Alpen Gold,True,"ООО ""Мондэлис Русь""",160г,,,Шоколад молочный Альпен Гольд МаксФанарахис/драже/карамель 160г
46910,семга ломтики с/с,Не Бренд,True,,100г,,,"Семга ломтики с/с, 100г  (СК)"
93159,каша черника/клубника/сливки,Everyday,True,"ООО ""Си-Проджект""",6*36г,,,Каша Everyday Черника/Клубника/Сливки 6*36г
242660,мороженое рожок крем-брюле,Не Бренд,True,"ООО ""Лагуна Койл""",100г,,,"Мороженое Рожок Юпитер Гигант крем-брюле,100г"
46922,сардельки,Клинский МК,True,"ОАО ""Мясокомбинат Клинский""",кг,,,Сардельки Клинские Клинский МК. кг
111642,фасоль из печи 1/12,Маринадовъ,,"ООО ""Астраханский консервный комбинат""",530 гр.,,с/б,Фасоль из печи с/б. 530 гр.. 1/12
118301,чай корона российской империи в пирамидках,Майский,,,20пакх2г,,,Чай Корона Российской Империи 20пакх2г в пирамидках
84387,мармелад чудо ягода яркий вкус малина брусника черная смородина,Рот Фронт,,"ОАО ""Тульская кондитерская фабрика ""Ясная Поляна""",250г,,,Мармелад Чудо Ягода яркий вкус малина. брусника. черная смородина 250г
242642,конфеты шоколадные ассорти,Коркунов,True,"ООО ""Одинцовская кондитерская фабрика""",135г,,,Конфеты шоколадные Коркунов Ассорти 135г
488276,напиток б/алк сильногаз тархун,Старые Добрые Традиции,True,"ООО ""ФКПЧФ Бобимэкс тм""",0.5 л,,,Напиток Старые Добрые традиции б/алк сильногаз Тархун 0.5 л
243655,конфеты ромашки,Рот Фронт,True,"ОАО ""Рот Фронт""",250г,,,Конфеты Ромашки Рот Фронт 250г
174870,молоко сгущенное цельное с сах,Смешная Корова,True,"ЗАО ""Верховский молочно-консервный завод""",250г,,,Молоко сгущенное Смешная Корова цельное с сах. 250г
180719,шпроты в масле,Морской Котик,True,РК За Родину,160г,,,Шпроты в масле Морской Котик 160г
243849,паштет охотничий из говядины,PL NoName,True,"ОАО ""Великоновгородский мясной двор""",90г,,,Паштет Охотничий из говядины 90г PL FP
42676,желудки куриные охл,Птица,True,"ЗАО ""Приосколье"", Россия",кг,,,"Желудки куриные охл. ГВУ Приосколье, кг"
242787,макароны вермишель яичная,ameria,True,"ООО ""Макаронная фабрика ""Америя""",400г,,,Макароны ameria Вермишель яичная 400г
104633,сосиски детские витаминизированные,Клинский МК,True,"ОАО ""Мясокомбинат Клинский""",150г,,,Сосиски Детские витаминизированные Клинский МК 150г
155928,семена льна,Ирис,True,"ООО ""Лексырье""",250г,,,Семена льна Ирис 250г
90271,яйцо куриное с1 экстра,Роскар,True,,,,18шт,Яйцо куриное С1 Экстра Роскар 18шт
199922,сыр салакис,PRESIDENT,True,Somboled d. o. o,500г,,,Сыр Салакис Президент 500г
243787,ветчина нежная,Царицыно,True,"ОАО ""Фирменный Торговый Дом Царицыно""",400г,,,Ветчина Нежная Царицыно 400г
58846,колбаса в/к сервелат мускатный,РЕМИТ,True,"МПЗ ""Ремит""",кг,,в/у,Колбаса в/к Сервелат Мускатный в/у. кг РЕМИТ
200234,масло олив extra virgin кувшин,Rafael Salgado,True,,"0,5л",,ст/бут,"Масло олив RAFAEL SALGADO 0,5л Extra Virgin (кувшин) ст/бут"
92243,кефир йодированный,Рузское молоко,True,"ОАО ""Рузское молоко""",500г,"2,5%",пюр-пак,"Кефир Рузский йодированный 2,5% 500г пюр-пак"
103580,варенье малиновое,Абрико,True,"ООО ""ПХП""",250г,,,Варенье Абрико малиновое 250г
123798,ассорти скумбрия/горбуша кусочки х/к,Томилинская,True,"ООО ""СОЮЗ-БИЛЛИОН""",300г,,в/у,Ассорти скумбрия/горбуша Томилинская кусочки х/к 300г в/у
53910,бедро индейки охл,Краснобор,True,,кг,,,"Бедро индейки охл.  Краснобор ,кг"
92516,фасоль красная в т/с,Фрау Марта,True,"ООО ""Промконсервы""",310г,,ж/б,Фасоль красная в т/с Фрау Марта 310г ж/б
109027,творог крестьянский,Благода,True,"ООО ""Молочное дело - Ивня""",200г,12%,,Творог Благода Крестьянский 12% 200г
58721,скумбрия б/г н/р с/м,Не Бренд,True,,кг,,п/пак,Скумбрия б/г н/р с/м . кг Ленморепродукт п/пак
180072,шоколад темный с кенийским кофе,Café Tasse,True,Choc And Co s.a,85г,,,Шоколад темный Кафе Тассе с кенийским кофе 85г
580446,молоко стерил тба,Домик в деревне,True,"ОАО ""Вимм-Билль-Данн""",925мл,3.2%,,Молоко стерил Домик в деревне 3.2% 925мл ТБА
242209,крупа киноа,Мистраль,True,"ООО ""Мистраль Трейдинг""",500г,,,Крупа Киноа 500г Мистраль
193771,приправа тимьян био,Santa-Maria,True,"Santa Maria AB, Швеция",10г,,,Приправа Santa Maria Тимьян 10г БИО
245603,печенье salinis крендельки,Dr.Schar,True,Dr. Schar,60г,,,Печенье Schar Salinis крендельки 60г
180746,сыр рикотта light,Bonfesto,True,"ОАО ""Туровский молочный комбинат""",250г,40%,,Сыр Рикотта Light Bonfesto 40% 250г
140322,шницель из свинины,Самсон,True,,400г,,,Шницель из свинины Самсон 400г
139837,напиток макс б/алк среднегаз,Лаймон Фреш,True,"ООО ""Юнайтед Боттлинг Групп""",0.33 л,,ж/б,Напиток Лаймон фрэш макс б/алк среднегаз 0.33 л ж/б
112504,напиток стер сыворот-мол neo клубника,Мажитель,True,"ОАО ""Вимм-Билль-Данн""",950г,"0,05%",,"Напиток стер сыворот-мол Мажитель NEO 0,05% 950г Клубника"
244172,коктейль мол стерил со злаками гречка tba,Агуша,True,"ОАО ""Вимм-Билль-Данн""",209г,3%,,Коктейль мол стерил Агуша Я САМ 3% со злаками Гречка 209г TBA
197351,артишоки резаные в подс масле coelsanus,Iberica,,Coelsanus Ind. Cons. S.p.A.,314 мл,,,Артишоки резаные в подс.масле Coelsanus 314 мл
327116,майонез провансаль organic,Mr.Ricco,True,"ОАО ""Казанский жировой комбинат""",400 мл,67%,дой-пак,Майонез Mr.Ricco провансаль Organic  67% 400 мл дой-пак
244748,каша гречневая с говядиной,Главпродукт,True,"ЗАО ""Орелпродукт""",340г,,ж/б,Каша гречневая Главпродукт с говядиной 340г ж/б
112057,сосиски,ВЕЛКОМ,True,,600 гр,,в/у,Сосиски Велком в/у 600 гр
204524,кетчуп томатный,Балтимор,True,ООО «Юнилевер Русь»,330г,,дой-пак,Кетчуп Балтимор томатный 330г дой-пак
134870,хлебушки зерновые,Настюша,True,"ООО Торговый дом ""Настюша""",2х35г,,,Хлебушки зерновые 2х35г Настюша
547203,квас,Очаковский,True,"ЗАО МПБК ""Очаково""",2л,,пэт,Квас Очаковский 2л ПЭТ
44165,сыр,Ламбер,True,,1кг,,,Сыр Ламбер  1кг
147093,лещ сол/сушеный,Не Бренд,,,250г,,,"Лещ сол/сушеный, 250г"
122692,ананасы кусочками,Фрау Марта,True,Minh Dung Private Enterprise,565г,,ж/б,Ананасы кусочками Фрау Марта 565г ж/б
120662,хлебцы гречневые с витаминами,Dr.Korner,True,"ОАО ""Хлебпром""",100г,,,Хлебцы Dr.Korner Гречневые с витаминами 100г
182096,приправа копченый техасец,Grill Mates,True,McCormick Polska S.A.,20г,,,Приправа Grill Mates Копченый Техасец 20г
243171,торт тирамису,Шереметьевские торты,True,"ООО ""Кондитерская фабрика ""Сладкий мир""",1.3кг,,,"Торт ""Тирамису"" Шереметьевские Торты 1.3кг"
131308,морской коктейль,Не Бренд,True,"ЗАО ""Русская рыбная компания"", Россия",500г,,пакет,Морской коктейль 500г РРК пакет
245249,хлеб геркулес с отрубями в нарезке,Хлебный дом,True,"ОАО ""Фацер""",500г,,,Хлеб Геркулес Хлебный дом с отрубями в нарезке 500г
141134,шоколад аленка с миндалем,Красный октябрь,,"ОАО ""Красный Октябрь""",100г,,,Шоколад Аленка с миндалем 100г
198136,оливки б/к d o p,Monini,True,MONINI SPA,120г,,ст/б,Оливки б/к Monini D.O.P. ст/б 120г
242843,продукт творожный домашний рассыпчатый,Снеда,True,"ООО ""Молочное дело""",500г,12%,пакет,Продукт творожный Снеда домашний рассыпчатый 12% 500г пакет
134800,наггетсы c сыром и грибами,Садия,True,"ООО ""Мираторг-Запад""",300г,,,Наггетсы c сыром и грибами 300г Мираторг
242129,ветчина нежная из отборной говядины,Останкино,True,"ОАО ""ОМПК""",500г,,,Ветчина Нежная из отборной говядины Останкино 500г
168418,гот завтрак choca шоколадные шарики,Ого!,True,"ЗАО ""Науясис Невежис""",250г,,,Гот.завтрак ОГО! CHOCA шоколадные шарики 250г
199607,макароны мафальдине,Barilla,True,,500г,,,Макароны Barilla Мафальдине 500г
131799,креветки в/м нераздел отборные 90/120,Не Бренд,True,"ООО ""Агама Роял Гринланд"", Россия",850г,,,"Креветки в/м нераздел. Отборные 90/120, 850г Бухта изобилия"
47743,азу из говядины охл эколь,Не Бренд,,,кг,,,"Азу из говядины охл. Эколь, кг"
83325,напиток яблоко,Gold Классик,True,"ОАО ""ВБД Напитки""",1.93л,,т/пак,Напиток Gold Классик яблоко 1.93л т/пак
92649,блинчики с абрикосом,Морозко,True,"ООО ""Морозко""",370г,,,Блинчики с абрикосом 370г Морозко
76573,биотворог груша,Фрутоняня,True,"ОАО ""Брянский гормолзавод""",100г,5%,,Биотворог Фрутоняня груша 5% 100г
108578,жульен из курицы с грибами,Не Бренд,True,"OOO ""TPK ""VILON""",2х135г,,,Жульен из курицы с грибами 2х135г Сытоедов
90252,суп мясной с вермишелью,101 Бакалея,True,"ОАО ""Русский продукт""",60г,,,Суп Мясной 101 Бакалея с вермишелью 60г
95183,пирог тирольский йогурт-тропик,Тирольские пироги,,"ЗАО ""Круг""",620г,,,"Пирог Тирольский ""Йогурт-тропик"" 620г"
192290,чай зеленый высокогорный bio olong,"ТМ ""BIO OLONG""",,,100 гр.,,ж/б,ЧАЙ ЗЕЛЕНЫЙ ВЫСОКОГОРНЫЙ BIO OLONG 100 ГР. Ж/б
123886,горбуша ломтики х/к,Томилинская,True,"ООО ""СОЮЗ-БИЛЛИОН""",350г,,в/у,Горбуша ломтики Томилинская х/к 350г в/у
167905,конфеты шоколадные ассорти,Laima,True,,95г,,,Конфеты шоколадные Лайма Ассорти 95г
108398,желе фруктовое гармония персик в желе,Stailon,True,"ЗАО ""Молочный завод ""Преображенский""",150г,,,Желе фруктовое Stailon Гармония Персик в желе 150г
258660,масло e v олив,Olliani,True,"ООО ""ПремиумБрэндс""",500мл,,,Масло Olliani E.V. олив 500мл
551563,напиток к/м тан,Лесная сказка,True,"ООО ""Лесная сказка-центр""",1л,1%,,Напиток к/м Тан Лесная Сказка 1% 1л
239169,биойогурт густой обог яблоко-чернослив,Активиа,True,"ООО ""Данон Индустрия""",210г,2.4%,стакан,Активия Биойогурт густой обог. Яблоко-чернослив 2.4% 210г Стакан
120501,мороженое филевский брикет на вафлях пломбир б/н,айс-фили,,"ООО ""Вологодское Мороженое""",80г,,,"Мороженое Филевский брикет на вафлях пломбир б/н,80г"
112278,смесь ! айкью,ЕМ,True,,40г,,,Смесь ЕМ! Айкью 40г
80033,смесь мучная хлеб многозерновой английский,ХлебБург,True,"ПАО ""Петербургский мельничный комбинат""",400г,,,Смесь мучная ХлебБург Хлеб многозерновой Английский 400г
120040,сахарная пудра со вкусом ванили,Dr.Oetker,True,"ЗАО ""Д-р Оеткер""",80г,,,Сахарная пудра со вкусом ванили 80г Dr.Oetker
243726,чай зеленый с жасмином в конв,О'КЕЙ,True,"ООО ""Мал Ком""",25х2г,,пак.,Чай зеленый ОКЕЙ с жасмином 25х2г пак. в конв.
244268,кофе раствор триумф,Жокей,True,"ООО""Орими Трэйд""",150г,,м/у,Кофе раствор. Жокей Триумф 150г м/у
195063,конфеты молочный с начинкой,Lindt,True,Chocoladenfabriken Lindt & Sprungli GmbH,200г,,,Конфеты Lintd Lindor Молочный с начинкой 200г
52597,яблоки роял гала,Не Бренд,,,кг,,,"Яблоки Роял Гала, кг"
152150,шпроты в масле,Рижский залив,True,"ООО ""БАРКО""",250г,,,Шпроты в масле Рижский Залив 250г
243480,сыр 16 долек ассорти,PRESIDENT,True,Лакталис Истра,280г,,,Сыр PRESIDENT 16 долек ассорти 280г
244790,пирожное воздушное со сливочным кремом,Большевик,True,"ООО ""Венский цех""",160г,,,"Пирожное ""Воздушное"" Большевик со сливочным кремом 160г"
198254,соус песто классический с базиликом дженовезе доп,Biffi,True,FORMEC BIFFI S.p.a.,190г,,,Соус Биффи Песто классический с базиликом Дженовезе Доп 190г
114795,фасоль по-домашнему с грибами,Пиканта,True,"ООО ""Плодородный край""",530г,,,Фасоль по-домашнему Пиканта с грибами 530г
179502,кофе н/ж мол мокка,Safari Coffee,True,ПЛЕНОЧНЫЕ МАТЕРИАЛЫ ВЫСОКОБАРЬЕРНЫЕ,200г,,,Кофе Safari Coffee н/ж мол Мокка 200г
52185,грудка цыпленка охл вал,Саянский бройлер,,,кг,,,Грудка цыпленка охл. вал. кг
594799,десерт молокосод монте шоколад/лесной орех,Zott,True,Zott SE & Co.KG,100 г,13.3%,,Десерт молокосод. Zott Монте 100 г 13.3% шоколад/лесной орех
245035,батончик мюсли клюква аглиадиновый,CORNEX,True,"ООО ""Ладинвест""",25г,,,Батончик мюсли Cornex Клюква 25г аглиадиновый
157214,молоко утп,Домик в деревне,True,"ОАО ""Вимм-Билль-Данн""",950г,1.5%,,Молоко УТП Домик в деревне 1.5% 950г
567970,напиток чай зеленый лимон негаз б/а,Nestea,True,"ООО ""Кока-Кола Эйчбиси Евраазия""",0.5л,,пэт,Напиток Nestea зеленый лимон негаз б/а 0.5л ПЭТ
594764,вода пит негаз стол,Святой источник,True,"ООО ""Эдельвейс Л""",1.5л,,пэт,Вода Святой Источник пит.негаз.стол.1.5л ПЭТ
78282,продукт творож персик,Даниссимо,True,"ООО ""Данон Индустрия""",130г,"5,4%",,"Продукт творож Даниссимо 5,4% 130г персик"
90314,яйцо куриное со счастливое,Роскар,True,,,,10шт,Яйцо куриное СО Счастливое Роскар 10шт
242456,лапша яичная говядина по-домашнему т/ч,Роллтон,True,"ООО ""Маревен Фуд Сэнтрал""",95г,,,Лапша Роллтон яичная говядина по-домашнему 95г т/ч
