raw_id,sqn,brand,brand_detected,product_manufacturer,weight,fat,pack,pfqn
243133,продукт сырный плавленый городской pl fp,Омский завод плавленых сыров,,ООО Ястро,70г,,фольга,Продукт сырный плавленый Городской фольга PL FP 70г
147414,напиток б/алк сильногаз ароматизир,Pepsi-Cola,True,"ООО ""ПепсиКо Холдингс""",0.33 л,,ж/б,Напиток Пепси Кола б/алк сильногаз ароматизир 0.33 л ж/б
244421,икра мойвы с дымком в майонезном соусе,VICI,True,"ООО ""Вичюнай-Русь""",150г,,,Икра мойвы VICI с дымком в майонезном соусе 150г
242460,рисовая лапша по-вьетнамски соус фо бо,BIGBON,True,Viet Hung Food Industry Company Limited,75г,,,Рисовая лапша BIGBON по-вьетнамски + соус Фо Бо 75г
182062,приправа д/курицы,Kamis,True,,30г,,,Приправа Kamis д/курицы 30г
134504,шарики куриные охл,Петелино,True,,кг,,,Шарики куриные охл. Петелино. кг
159812,набор трюфельные палочки,Метрополь,True,"ООО ""Север-Метрополь""",340г,,4шт,"Набор ""Трюфельные палочки"" Метрополь 4шт 340г"
575167,сок томат/соль,Rich,True,"ЗАО ""Мултон""",1л,,т/пак,Сок Rich томат/соль 1л т/пак
92532,фасоль белая пикантная в т/с,Фрау Марта,True,"ООО ""Промконсервы""",310г,,ж/б,Фасоль белая пикантная в т/с ж/б Фрау Марта 310г
598288,сыр моцарелла,Apetina,True,"ООО ""Сыроварня ""Волжанка""",130г,44%,,Сыр Моцарелла Апетина 44% 130г
136789,крекер янтарный с отрубями,Любятово,True,"ООО ""Келлогг Рус""",230г,,,Крекер Любятово Янтарный с отрубями 230г
57380,говядина зам голяшка б/к,Не Бренд,True,"ООО ""Мясной стандарт"", Россия",кг,,в/у,Говядина зам. голяшка б/к в/у Максума. кг
76557,мороженое щербет ч/смородина,Петрохолод,,,80г,,,Мороженое Щербет ч/смородина 80г
52857,хурма отборная,Не Бренд,,,кг,,,"Хурма отборная, кг"
358777,напиток палпи из апельсина с мякотью сокосодерж,Добрый,True,"ООО ""Кока-Кола Эйчбиси Евраазия""",0.9л,,пэт,Напиток Добрый Палпи из апельсина с мякотью сокосодерж.0.9л ПЭТ
132892,напиток сыворотка с соком апельсин/манго,АКТУАЛЬ,True,"ОАО ""Компания ЮНИМИЛК""",330г,,пэт,Напиток сыворотка с соком Актуаль апельсин/манго 330г ПЭТ
90889,молоко утп бутылка,Агуша,True,"ОАО ""Вимм-Билль-Данн""",270г,3.2%,,Молоко УТП Агуша 3.2% 270г бутылка
601782,Долмио с базиликом,Dolmio,True,,350г,,,Долмио с базиликом 350г
93017,молоко пастер,Из Вологды,True,ТД Молочное,1кг,"2,5%",пюр-пак,"Молоко пастер Из Вологды 2,5% 1кг пюр-пак"
157075,молоко утп,Домик в деревне,True,"ОАО ""Вимм-Билль-Данн""",950г,2.5%,,Молоко УТП Домик в деревне 2.5% 950г
139937,щербет с изюмом и орехом,Аль-Араби,True,"ООО КФ ""Надежда""",280г,,,Щербет Аль-Араби с изюмом и орехом 280г
88351,трубочка вафельная сгущ варён-молочн крем,Дмитровский молочный завод,True,"ОАО ""Дмитровский Молочный Завод""",70г,18.4%,,Трубочка вафельная Дмитровский МЗ 18.4% 70г сгущ варён-молочн крем
594797,монте десерт шоколад/лесной орех maxi рио,Zott,True,Zott SE & Co.KG,4*100г,,,Монте десерт шоколад/лесной орех Zott Maxi 4*100г РИО
119497,напиток плей морк/ябл/лайм/арбуз б/алк негаз,Теди,True,"СМПМарк-IV""",0.4л,,пэт,Напиток Теди Плей морк/ябл/лайм/арбуз б/алк негаз 0.4л ПЭТ
200126,оливки с анчоусом,Ибарра,True,"ACEITES YBARRA, S.A.",240г,,,Оливки Ибарра с анчоусом 240г
67310,заменитель сахара,Huxol,True,Nutrisun GmbH & Co,,,1200 таб,Заменитель сахара Huxol 1200 таб
44317,бедро цыпленка охл,Приазовская,True,,кг,,,"Бедро цыпленка охл. Троекурово, кг"
81073,коктель из морепродуктов в рассоле,Меридиан,True,"ОАО ПКП ""Меридиан"", Россия",430г,,пл/б,Коктель из морепродуктов Меридиан в рассоле 430г пл/б
592456,сок апельсин,Золотая Русь,True,,0.2л,,ст/б,Сок Золотая Русь апельсин 0.2л ст/б
165634,биотворог,Тема,True,"ОАО ""Компания ЮНИМИЛК""",100г,5%,,Биотворог Тема 5% 100г
173555,паштет из тунца,John West,True,John West Foods Ltd,125г,,,Паштет John West из тунца 125г
243048,сухари с маком,О'КЕЙ,True,"ООО ""Воплощение""",350г,,,Сухари ОКЕЙ с маком 350г
107014,макароны перья ребристые,Байсад,True,,450г,,,Макароны Байсад Перья ребристые 450г
108674,грибы грузди белые консервированные соленые,О'КЕЙ,True,"ООО ""ТАЙГА-ПРОДУКТ""",500г,,,Грибы грузди белые ОКЕЙ консервированные соленые 500г
67122,кофе растворим рич ст,Davidoff,True,,100г,,,Кофе растворим Давидоф Рич 100г ст
242455,лапша по-домашнему курица т/т,Роллтон,True,"ООО ""Маревен Фуд Сэнтрал""",100 г,,,Лапша Роллтон по-домашнему курица 100 г т/т
48019,говядина охл юбилейная халяль эколь,Не Бренд,,,кг,,,"Говядина охл. Юбилейная Халяль Эколь, кг"
66004,мармелад жевательный фрути-буззи,Haribo,True,,100г,,,Мармелад жевательный Фрути-Буззи 100г Харибо
281863,нектар ябл/вишня,Сады Придонья,True,"ОАО ""Сады Придонья"", Россия",1л,,т/пак,Нектар Сады Придонья ябл/вишня 1л т/пак
371584,вода мин природ газ,Нарзан,True,"ОАО ""Нарзан""",0.5л,,ст/б,Вода Нарзан мин.природ.газ.0.5л ст/б
243230,крупа кукурузная,Агроальянс,True,Агроальянс,800г,,,Крупа Кукурузная 800г Агро-Альянс
152945,мука ржаная обдирная,Кудесница,True,"ПАО ""Петербургский мельничный комбинат""",900г,,,Мука Кудесница ржаная обдирная 900г
141316,кофе exclusive brasilia раств,Черная Карта,True,СТЕКЛО,95г,,ст/б,Кофе Черная Карта Exclusive Brasilia раств.95г ст/б
134801,куриное филе бедра в панировке миланезе,Садия,True,"ООО ""Мираторг-Запад""",360г,,,Куриное филе бедра в панировке Миланезе 360г Мираторг
457878,напиток энергетический б/а газ,BULLIT,True,BULLIT GMBH,0.5л,,ж/б,Напиток Буллит энергетический б/а газ 0.5л ж/б
243735,сосиски ц/о,Рублёвский,True,"ООО ""Торговый дом ""Москворецкий""",480г,,,Сосиски Рублевские ц/о Рублевский 480г
107018,макароны гребешки,Байсад,True,,450г,,,Макароны Байсад Гребешки 450г
241288,сардельки нежные,Царицыно,True,"ОАО ""Фирменный Торговый Дом Царицыно""",кг,,,Сардельки Нежные Царицыно. кг
52049,бананы,Не Бренд,,,кг,,,"Бананы, кг"
116092,сушки ванильные,О'КЕЙ,True,"ООО ""Воплощение""",400г,,,Сушки ОКЕЙ ванильные 400г
79979,мука овсяная ту,Кудесница,True,"ПАО ""Петербургский мельничный комбинат""",0.8кг,,,Мука Кудесница овсяная ТУ 0.8кг
146973,анчоус сол/сушеный,Не Бренд,True,"ООО ""Каспий""",100г,,,Анчоус сол/сушеный Каспий 100г
157342,десерт творож творожок вишня-черешня,Чудо,True,"ОАО ""Вимм-Билль-Данн""",100г,4%,,Десерт творож Чудо творожок вишня-черешня  4% 100г
272937,компот из вишни,О'КЕЙ,True,"""Фрукто Сливен""",580мл,,ст/б,Компот ОКЕЙ из вишни 580мл ст/б
113983,томаты в с/соку,Green Ray,True,"ООО ""Техада""",720 мл,,,Томаты в с/соку Грин Рэй 720 мл
594514,колбаса в/к сервелат,ВЕЛКОМ,True,"ООО ""Мясокомбинат ""Павловская Слобода""",кг,,,Колбаса в/к Сервелат ВЕЛКОМ. кг
161930,масло сливочное,Не Бренд,True,ООО «Невские сыры»,180г,72.5%,,Масло сливочное 72.5% 180г ГОСТ 52253
53349,колбаса в/к сервелат финский,Останкино,True,"ОАО ""ОМПК""",кг,,,Колбаса в/к Сервелат Финский Останкино. кг
594568,нектар яблоко,Любимый,True,"ОАО ""Вимм-Билль-Данн""",1.93л,,т/пак,Нектар Любимый яблоко 1.93л т/пак
93009,кефир,Из Вологды,True,"ОАО ""Учебно-опытный молочный завод ""ВГМХА имени Н.В.Верещагина""",470г,"2,5%",пюр-пак,"Кефир Из Вологды 2,5% 470г пюр-пак"
147110,чай зеленый крупнолистовой,Сайгон,True,"ООО ""Каспий""",100г,,,"Чай зеленый крупнолистовой ""Сайгон"" 100г"
132947,смесь из орехов и сухофруктов витаминная смесь,PL NoName,True,"ООО ""Интелл""",300г,,,Смесь из орехов и сухофруктов Витаминная смесь 300г PL FP
113380,мороженое рожок гигант пломбир ванильный в пергаменте,Не Бренд,True,"ООО ""Чистая линия""",110г,,,Мороженое рожок Гигант пломбир ванильный в пергаменте 110г Чистая линия
157077,десерт творож творожок персик/маракуйя,Чудо,True,"ОАО ""Вимм-Билль-Данн""",100г,4.2%,,Десерт творож Чудо творожок персик/маракуйя 4.2% 100г
49093,корюшка крупная сол/сушеная,STANDARD,True,,100г,,,"Корюшка крупная дальневосточная сол/сушеная, 100г"
107115,лепёшки тортилья пшеничные с сыром,DELICADOS,True,"ЗАО ""Солнце Мехико""",400г,,,Лепёшки Тортилья Деликадос Пшеничные с сыром 400г
242786,макароны пружинки,ameria,True,"ООО ""Макаронная фабрика ""Америя""",400г,,,Макароны ameria Пружинки 400г
93545,мёд натуральный горный,Лесные угодья,True,"ООО ""Си-Проджект""",400г,,ст/б,Мёд натуральный Лесные Угодья горный 400г ст/б
70692,печенье лейбниц какаокекс,Balsen,True,Balsen GmbH & Co. KG,200г,,,Печенье Бальзен Лейбниц Какаокекс 200г
92779,картофель для жарки,Морозко Green,True,ООО Фзп,450г,,,Картофель для жарки Морозко Green 450г
113479,мёд абхазии эвкалиптовый,Honey Gallery,True,"ООО ""МЕДОВЫЙ ДОМ""",500г,,ст/б,Мёд Абхазии Honey Gallery эвкалиптовый 500г ст/б
602384,икра трески пробойная соленая красное золото,Не Бренд,,"ООО ""СевероВосточная компания ЛТД""",130г,,ж/б,"Икра трески пробойная соленая, 130г ж/б Красное Золото"
122261,колбаски с/к охотничьи,Малаховский,True,"ООО ""Малаховский мясокомбинат""",200г,,в/у,Колбаски с/к Охотничьи  Малаховский в/у 200г
66766,говядина тушеная в/с золотая серия,Главпродукт,True,"ЗАО ""Орелпродукт""",338г,,ж/б,Говядина тушеная Главпродукт в/с Золотая серия 338г ж/б
601858,майонез переп яйцо дой,Слобода,True,"ОАО ""ЭФКО""",800мл,67%,пак,Майонез Слобода переп яйцо 67% 800мл дой пак
490546,огурцы для сандвичей нарезанные,Hengstenberg,True,Hengstenberg,370мл,,,Огурцы Hengstenberg для сандвичей. нарезанные 370мл
113966,пельмени сочные из отборной говядины,Монарх,True,"ООО ""Алтайхолод""",1000г,,,Пельмени Монарх сочные из отборной говядины 1000г
156756,пекан,О'КЕЙ,True,"ЗАО ""ОРЕХПРОМ""",100г,,,Пекан ОКЕЙ 100г
203606,соус сырный,Calve,True,ООО «Юнилевер Русь»,230г,,дой-пак,Соус Calve сырный 230г дой-пак
21401,сахар-песок,Русский,,"ОАО ""Валуйкисахар""",1кг,,,Сахар-песок 1кг
82076,Приправа д/сочн курицы с чесноком,Maggi,True,,38г,,,Смесь Магги на второе д/сочн.курицы с чесноком 38г
193825,приправа лесной сбор скандинавский мельница,Santa Maria,True,"Santa Maria AB, Швеция",70г,,,Приправа Santa Maria Лесной сбор скандинавский 70г мельница
244898,шоколад молочный с молочной начинкой,Nesquick,True,"ООО""Нестле Россия""",100г,,,Шоколад молочный Несквик с молочной начинкой 100г
207715,приправа для гриля и шашлыка острая мельница,Kotanyi,True,Kotanyi GmbH,40г,,,Приправа Kotanyi для гриля и шашлыка Острая 40г мельница
134593,наггетсы куриные,Не Бренд,True,"ООО ""Мираторг-Запад""",280г,,,Наггетсы куриные Мирандия 280г Мираторг
197335,макароны вермишель,Maltagliati,True,P.A.P. srl CAPODRISE,500г,,,Макароны Maltagliati Вермишель 500г
167880,конфеты ассорти подарочная горк шок,Laima,True,"a/s ""LAIMA""",360г,,,Конфеты Ассорти Лайма Подарочная горк.шок.360г
101882,черная смородина протерт с сахаром,Главпродукт,True,"ООО ""Астраханка""",330г,,ст/б,Черная смородина Главпродукт протерт с сахаром 330г ст/б
43280,грейпфрут отборный,Не Бренд,,,кг,,,"Грейпфрут отборный, кг"
207950,соль йодированная морская мельница,Kotanyi,True,Kotanyi GmbH,92г,,,Соль Kotanyi Йодированная морская 92г мельница
193842,торт миндальный дайм,Альмонди,True,,400г,,,Торт миндальный Дайм 400г Альмонди
469024,нектар смесь фруктов,Добрый,True,"ЗАО ""Мултон""",2л,,т/пак,Нектар Добрый смесь фруктов 2л т/пак
156753,коктейль орех изюм,О'КЕЙ,True,"ЗАО ""ОРЕХПРОМ""",300г,,,Коктейль орех. изюм ОКЕЙ 300г
56034,крыло цыпленка 2 фаланги охл халяль,Ярославский Бройлер,True,"ООО ""Ярославский Бройлер"", Россия",кг,,,"Крыло цыпленка 2 фаланги охл. Халяль Ярославский Бройлер, кг"
602332,пельмени из отборной говядины,Ложкарев,True,"ООО ""Шельф-2000""",900г,,,Пельмени “Чудо-малыши” из отборной говядины. 900г
93470,ветчина куриная,Hungrow,True,,150г,,ж/б,Ветчина куриная  Hungrow 150г ж/б
95040,чай зеленый лимон,Принцесса Ява,True,"ООО ""НЕП"", Россия",,,25пак,Чай Принцесса Ява зеленый Лимон 25пак
244874,масло слив,Домик в деревне,True,"ОАО ""Вимм-Билль-Данн""",180г,"82,5%",фольга,"Масло слив Домик в деревне 82,5% 180г фольга"
448244,напиток к/м тан негаз с укропом и огурцом,Чистая линия,True,"ООО ""Чистая линия""",500мл,1%,,Напиток к/м Тан негаз Чистая линия с укропом и огурцом 1% 500мл
125755,сыр грюйер аос нежный,InterCheese AG,,"IntelCheese AG, Швейцария",150 г,45%-49%,,"Сыр ""Грюйер АОС нежный"". 45%-49%. 150 г"
110684,сырок глазир ваниль,Ростагроэкспорт,,ООО «РостАгроКомплекс»,45г,5%,фольга,Сырок глазир ваниль 5% 45г фольга
120853,мороженое брикет в коробке пломбир,Филевское,True,"ООО ""ТД Айсберри""",250г,,,Мороженое Брикет в коробке Филевский  пломбир 250г Айсберри
323156,батончик мюсли земляника,Виталад,True,"ЗАО ""Пищеваой комбинат ""Линфас""",40г,,,Батончик мюсли Виталад Земляника 40г
244337,шоколад молочный,Milka,True,"ООО ""Мон'дэлис Русь""",100г,,,Шоколад молочный Milka 100г
123842,огурцы корнишоны марин 3-6см,Огородников,True,"ООО ПК ""Сарепта-ПомидорПром""",670г,,ст/б,Огурцы корнишоны марин. 3-6см Огородников 670г ст/б
90670,икра пинагора черная,ОКЕАН ТРК,True,"ООО ""Океан Трейдинг Компании-П""",113г,,,Икра пинагора Океан черная 113г
88332,кефир,Дмитровский молочный завод,True,"ОАО ""Дмитровский Молочный Завод""",1кг,3.2%,,Кефир Дмитровский МЗ 3.2% 1кг
158400,мука пшеничная в/с,Макфа,True,"ОАО ""МАКФА""",1кг,,,Мука Макфа пшеничная в/с 1кг
515858,масло олив не раф,De Cecco,True,F.lli De Cecco di Fillipo Fara San Martino S.p.A.,500мл,,,Масло олив De Cecco не раф. 500мл
123791,салака х/к,Томилинская,True,"ООО ""СОЮЗ-БИЛЛИОН""",300г,,кор,Салака Томилинская х/к 300г кор
140502,сырок картошка,Б.Ю. Александров,True,ООО «РостАгроКомплекс»,50г,26%,,Сырок картошка Б.Ю.Александров 26% 50г
170214,напиток стер сыворот-мол neo пина-колада,Мажитель,True,"ОАО ""Вимм-Билль-Данн""",950г,"0,04%",,"Напиток стер сыворот-мол Мажитель NEO 0,04% 950г Пина-колада"
204567,кетчуп томат пластик,Heinz,True,"ООО ""Петропродукт - Отрадное""",1кг,,п/э,Кетчуп HEINZ Томат.п/э 1кг пластик
242840,сырок твор глазир кокос,Снеда,True,"ООО ""Молочное дело - Ивня""",50г,23%,,Сырок твор глазир Снеда кокос 23% 50г
105617,напиток зеленый энергетический б/а газ,MONSTER,True,"ООО ""Производственная компания ""ЛИДЕР""""""""""",0.5л,,пэт,Напиток Monster зеленый энергетический б/а газ 0.5л ПЭТ
175121,говядина тушеная 1 сорт,Главпродукт,True,"ОАО РАПП ""КАВКАЗ-МЯСО""",338г,,ж/б,Говядина тушеная Главпродукт 1 сорт 338г ж/б
295725,вода мин газ леч-стол,Липецкий Бювет,True,"ОАО ""ПРОГРЕСС""",0.5л,,пэт,Вода Липецкий Бювет мин.газ.леч-стол.0.5л ПЭТ
407040,напиток актив мята/лайм б/а негаз,Малаховская,True,"ООО ""Производственная компания ""ЛИДЕР""""""""""",1.5л,,пэт,Напиток Малаховская Актив Мята/Лайм б/а негаз 1.5л ПЭТ
93307,напиток bembery королевский виноград ябл/виногр б/а газ сок/сод,Си-Про,,"ООО ""Живые Соки""",0.75л,,ст/б,Напиток Bembery Королевский виноград ябл/виногр б/а газ.сок/сод 0.75л ст/б
43496,колбаса вареная любительская,Рублёвский,True,"ООО ""МПЗ ""Москворецкий""",кг,,,Колбаса вареная Любительская Рублёвский. кг
183975,печенье адвокатки,Artur,,ARTUR sp.z o.o.,210г,,,Печенье Адвокатки 210г
204515,кетчуп испанский,Calve,True,ООО «Юнилевер Русь»,350г,,дой-пак,Кетчуп Calve Испанский 350г дой-пак
44067,грудинка в/к пикантная,Мясная империя,True,"ООО ""МПК Мясная империя""",кг,,в/у,Грудинка в/к Пикантная Мясная Империя в/у. кг
50820,ассорти из мясных колбасок,Не Бренд,True,,кг,,,"Ассорти из мясных колбасок Самсон, кг"
244751,паштет нежный из печени индейки,Главпродукт,True,"ЗАО ""Орелпродукт""",240г,,ж/б,Паштет Главпродукт нежный из печени индейки 240г ж/б
175257,кофе в капсулах дольче густо лунго 201 4 капсулы,Nescafe,True,КАРТОН,,,,"Кофе в капсулах Нескафе Дольче Густо Лунго 201,4 капсулы"
174454,соус терияки,Blue Dragon,True,,440г,,,Соус Blue Dragon Терияки 440г
245454,батончик с арахисом и изюмом,Picnic,True,"ООО ""Мон'дэлис Русь""",62 г,,,Батончик PICNIC с арахисом и изюмом 62 г
45458,яблоки джоноголд,Не Бренд,,,кг,,,"Яблоки Джоноголд, кг"
132959,напиток сыворотка с соком апельсин/манго,АКТУАЛЬ,True,"ОАО ""Компания ЮНИМИЛК""",930г,,пэт,Напиток сыворотка с соком Актуаль апельсин/манго 930г ПЭТ
80117,мороженое пломбир суфле в шоколаде,Золотой Стандарт,True,ООО «Юнилевер Русь»,500г,,,Мороженое пломбир Суфле в шоколаде 500г Золотой стандарт
120939,кофе растворимый ст,Tchibo,True,"ООО ""ЧИБО СНГ"", Россия","47,5г",,,"Кофе растворимый Чибо Голд Селекшен 47,5г ст"
152923,шоколад черный белый молочный с орехами в кусочках,Schogetten,True,Triumf Schokoladefabrik GmbH,100г,,,Шоколад Schogetten черный. белый. молочный с орехами в кусочках 100г
221119,напиток чай vitao зеленый клубника/алое негаз б/а,Nestea,True,"ООО ""Кока-Кола Эйчбиси Евраазия""",0.5л,,пэт,Напиток Nestea Vitao зеленый клубника/алое негаз б/а 0.5л ПЭТ
