raw_id,sqn,brand,brand_detected,product_manufacturer,weight,fat,pack,pfqn
139844,напиток стилл лайт макс б/алк негаз,Лаймон Фреш,True,"ООО ""Юнайтед Боттлинг Групп""",0.5 л,,пэт,Напиток Лаймон фрэш стилл лайт макс б/алк негаз 0.5 л ПЭТ
54822,салями королевская в/к,МОРТАДЕЛЬ,True,"ООО ""Фирма ""Мортадель""",кг,,,"Салями Королевская в/к , кг Мортадель"
526741,напиток чай черный персик негаз б/а,Nestea,True,"ООО ""Кока-Кола Эйчбиси Евраазия""",1.75л,,пэт,Напиток Nestea чай черный персик негаз б/а 1.75л ПЭТ
93519,мёд натуральный липовый,Лесные угодья,True,"ООО ""Си-Проджект""",250г,,ст/б,Мёд натуральный Лесные Угодья липовый 250г ст/б
242044,крабовые палочки охл,Меридиан,True,"ООО""Меридиан""",200г,,,Крабовые палочки Меридиан охл 200г
241804,продукт творож манго апельсин,Даниссимо,True,"ООО ""Данон Индустрия""",130г,"5,4%",,"Продукт творож Даниссимо 5,4%130г манго+апельсин"
94387,баранки сдобн,Волжский пекарь,True,"ОАО ""Волжский пекарь""",500г,,,Баранки сдобн. Волжский пекарь 500г
157083,коктейль мол стер аром банан-карамель,Чудо,True,"ОАО ""Вимм-Билль-Данн""",960г,2%,,Коктейль мол.стер.аром. Чудо Банан-карамель 2% 960г
77672,биойогурт обог б/б мюсли,Активиа,True,"ООО ""Данон Индустрия""",150г,3.2%,,Биойогурт обог.б/б Активия 3.2% мюсли 150г
94891,чай черный эрл грей фентази,Greenfield,True,КАРТОН,,,100пак,Чай черный Greenfield Эрл Грей Фентази 100пак
602747,маринад терияки,Santa-Maria,True,,75г,,,Маринад Терияки 75г Санта Мария
243264,хрен столовый ядреный,Огородников,True,"ООО ПК ""Сарепта-ПомидорПром""",190г,,ст/б,Хрен Огородников столовый ядреный 190г ст/б
80100,цикорий раств ст,Русский Цикорий,True,"ЗАО ""Еремеевское""",330г,,,Цикорий раств. 330г ст Русский Цикорий
144199,петрушка,Не Бренд,,,40г,,упак,"Петрушка 40г, упак"
74038,огурцы пикантные,Stollenwerk,True,J & W Stollenwerk oHG,1550г,,,Огурцы Stollenwerk пикантные 1550г
244114,коктейль пастер молочный клубника,Чудо,True,"ОАО ""Вимм-Билль-Данн""",270г,2%,,Коктейль пастер Чудо молочный  2% клубника 270г
118294,чай черный крепкий,Лисма,True,"ЗАО Компания ""Май""",,,25пак,Чай черный Лисма Крепкий 25пак
41896,редис импортный,Не Бренд,,,кг.,,,"Редис импортный, кг."
346628,вода пит негаз,Аква Минерале,True,"ООО ""ПепсиКо Холдингс""",0.6л,,пэт,Вода Аква Минерале пит.негаз.0.6л ПЭТ
115098,сельдь в масле fp,РРМ,,"ОАО ""Русский рыбный мир""",250г,,,Сельдь в масле 250г FP
502772,молоко стерил,МОЖАЙСКОЕ,True,"ЗАО ""Завод стерилизованного молока ""Можайский""""""""""",0.45л,3.2%,,Молоко стерил Можайское 3.2% 0.45л
185420,тунец кусочками в собственном соку,Fortuna,True,"Golden Prize Canning Co,,Ltd",185г,,,Тунец кусочками Fortuna в собственном соку 185г
161919,мед цветочный,Не Бренд,True,"ООО ""Пчеловод""",500г,,ст/б,Мед цветочный Алтайский 500г ст/б
81076,икра лососевая зернистая,Меридиан,True,"ООО""Меридиан""",140г,,ж/б,Икра лососевая Меридиан зернистая 140г ж/б
200130,оливки с лимоном,Ибарра,True,"ACEITES YBARRA, S.A.",240г,,,Оливки Ибарра с лимоном 240г
108647,форель филе-кусок с/с,Балтийский берег,True,"ЗАО ""Балтийский Берег""",200г,,в/у,Форель Балтийский Берег филе-кусок с/с 200г в/у
47111,окорочок утиный замор венгрия,Птица,,,кг,,,"Окорочок утиный замор Венгрия, кг"
78076,биойогурт,Останкинское,True,"ОАО ""Останкинский молочный комбинат""","0,21л","2,5%",стакан,"Биойогурт Останкинская 2,5% 0,21л стакан"
107342,мельница итальянские травы,О'КЕЙ,True,"ООО ""АЙДИГО""",70г,,,Мельница ОКЕЙ итальянские травы 70г
244349,биотворог груша,Тема,True,"ОАО ""Компания ЮНИМИЛК""",100г,"4,2%",,"Биотворог Тема 4,2% Груша 100г"
148907,оливки греческие гигант с/к,Франко Оллиани,True,,280 мл,,ст/б,"Оливки Olliani греческие ""Гигант"" с/к 280 мл ст/б"
109179,торт сказка от,Господарь,True,"ООО ""Кондитерский мир""",800г,,,"Торт ""Сказка от Господаря"" 800г"
90303,яйцо куриное с1 роскар,Не Бренд,,,,,30шт,Яйцо куриное С1 Роскар 30шт
76894,напиток б/а сильногаз аромат со вкусом лимона и лайма,7-UP,True,"ООО ""ПепсиКо Холдингс""","0,6 л",,,"Напиток Севен Ап б/а сильногаз аромат со вкусом лимона и лайма 0,6 л"
90831,кефир детский tba,Агуша,True,"ОАО ""Вимм-Билль-Данн""",204г,"3,2%",,"Кефир детский Агуша 3,2% 204г TBA"
242774,мороженое фестино шоколад,Не Бренд,,"ООО ""Великолукская фабрика мороженого""",70г,,стакан,"Мороженое стакан Фестино шоколад, 70г"
242580,овощи по-деревенски,4 сезона,True,"ООО ""Хладокомбинат Западный""",400г,,,Овощи по-деревенски 4 сезона 400г
148665,чай зеленый milky oolong с/я,DENKER,True,"ООО ""Яковлевская чаеразвесочная фабрика""",,,20пак,Чай зеленый Дэнкер Milky Oolong 20пак с/я
594593,круассан с шоколадной начинкой,Черемушки,True,"ОАО ""КБК ""Черемушки""",80г,,,Круассан с шоколадной начинкой 80г Черемушки
193823,приправа смесь 5 видов перцев мельница,Santa Maria,True,Santa Maria AB,60г,,,Приправа Santa Maria Смесь 5 видов перцев 60г мельница
76960,чай черный цейлонский крупнолистовой,О'КЕЙ,True,,100г,,,Чай черный ОКЕЙ цейлонский крупнолистовой 100г
144902,нектар персик/ябл с мякотью,Мой,True,"ОАО ""Сады Придонья"", Россия",0.95л,,т/пак,Нектар Мой персик/ябл с мякотью 0.95л т/пак
57358,колбаса докторская в/с н/о,РЕМИТ,True,"МПЗ ""Ремит""",кг,,в/у,Колбаса Докторская в/с н/о в/у. кг РЕМИТ
243992,котлеты по-киевски,Не Бренд,True,"ООО ""Продукты питания Комбинат""",440г,,,Котлеты по-киевски 440г Золотой Петушок
44279,голень цыпленка охл,Моссельпром,True,,кг,,,"Голень цыпленка охл. Моссельпром, кг"
48421,сыр сулугуни,ГИАГИНСКИЙ молзавод,True,"ОАО Молочный завод ""Гиагинский""",кг,,,Сыр Сулугуни  кг Гиагинский МЗ
301698,масло олив,Iberica,True,«Olive Line» S. L.,250мл,100%,ст/б,Масло олив 100% Iberica 250мл ст/б
250181,сок яблоко осв,J-7,True,"ОАО ""ВБД Напитки""",0.97л,,т/пак,Сок J7 яблоко осв.0.97л т/пак
182259,приправа д/мяса мельница,Kamis,True,McCormick Polska S.A.,48г,,,Приправа Kamis д/мяса 48г мельница
192364,суп мули грибы/яйцо,Гермен,True,"""Фуджиан Ориентлэнд Фудз Ко., лтд""",5*12г,,,Суп Гермен Мули грибы/яйцо 5*12г
600234,набор кофе растворимый спешел шоколад линдт,EGOISTE,True,"MACO Ltd, Швейцария",100г,,,Набор кофе растворимый Эгоист Спешел 100г + шоколад Линдт
73492,кофе раств,Tchibo,True,"""Tchibo Manufacturing Poland Sp.z.o.o."", Польша",95г,,ст/б,Кофе Чибо Эксклюзив раств. 95г ст/б
112979,пирожное творожные колечки,Мирэль,True,,210г,,,Пирожное Творожные колечки 210г Мирэль
43616,баранина окорок охл,Эколь,True,,кг,,,"Баранина окорок охл.Эколь, кг"
125497,шампиньоны резан с/м россия,VITAMIN,True,"ООО ""ТК ""Мираторг""",400г.,,,Шампиньоны резан. с/м 400г. Vитамин Россия
602209,кофе в зерне крема д`оро,Даллмайер,True,"Alois Dallmayr Kaffee oHG, Германия",500г,,,Кофе в зерне Крема Д`Оро Даллмайер 500г
141262,семечки премиум подсолн жареные отборные,От Мартина,True,"ООО ""МАРТИН""",200г,,,Семечки От Мартина Премиум подсолн жареные отборные 200г
47100,яблоки сезонные,Не Бренд,,,кг,,,"Яблоки сезонные , кг"
594112,макаронные изделия спагетти,О'КЕЙ,True,"ОАО ""Макаронно-кондитерское производство""",500г,,,Макаронные изделия ОКЕЙ Спагетти 500г
172179,хлеб старорусский тихвинский с семенами подсол,Каравай,True,"ОАО ""Каравай""",350г,,нарезка,Хлеб Старорусский Тихвинский с семенами подсол. нарезка 350г Каравай
140482,масса творожная изюм,Б.Ю. Александров,True,ООО «РостАгроКомплекс»,100г,23%,,Масса творожная Б.Ю. Александров 23% изюм 100г
93074,пюре картоф,Картошечка,True,"ООО "" Си - Продукт"", Россия",250г,,,Пюре картоф. Картошечка 250г
90285,яйцо куриное с1 экстра,Роскар,True,,,,25шт,Яйцо куриное С1 Экстра Роскар 25шт
131813,треска филе б/кожи с/м,STANDARD,True,"ООО ""Агама Роял Гринланд"", Россия",400г,,,"Треска филе б/кожи с/м, 400г Agama"
120037,дрожжи сухие,Dr.Oetker,True,"ЗАО ""Д-р Оеткер""",7г,,,Дрожжи сухие 7г Dr.Oetker
185008,сахар ванильный,Dr.Oetker,True,"ЗАО ""Д-р Оеткер""",8г,,,Сахар ванильный Dr.Oetker 8г
178969,кофе н/ж зерно эспрессо премиум,Safari Coffee,True,"ООО ""Сафари кофе трейдинг""",500г,,,Кофе Safari Coffee н/ж зерно Эспрессо Премиум 500г
361281,соус перечный чипотли,Heinz,True,H. J. Heinz Manufacturing UK Ltd,150г,,,Соус HEINZ Перечный Чипотли 150г
104047,лакедра сол/сушеная,STANDARD,True,"ООО ""Каспий""",100г,,упак.,"Лакедра сол/сушеная, 100г (Каспий) упак."
182278,приправа д/курицы мельница,Kamis,True,McCormick Polska S.A.,53г,,,Приправа Kamis д/курицы 53г мельница
168856,чай зеленый ассорти,MARGO,True,Femrich Lanka Ltd,,,25 пак,"Чай зеленый""MARGO"" Ассорти 25 пак"
34830,печень говяжья зам,Не Бренд,True,"ООО ""Мясной стандарт"", Россия",500г,,в/у,Печень говяжья зам. в/у Дары Артемиды 500г
242659,мороженое ванильное,Не Бренд,True,"ООО ""Лагуна Койл""",1кг,,пакет,Мороженое Юбилейное Ванильное пакет 1кг
560633,нектар персик/ябл,Фруктовый  сад,True,"ООО ""Лебедянский""",0.95л,,т/пак,Нектар Фруктовый Сад персик/ябл 0.95л т/пак
78186,биопродукт творож-йогуртный инжир/курага/чернослив,Активиа,True,"ООО ""Данон Индустрия""",130г,4.2%,,Биопродукт творож-йогуртный Активия 4.2% инжир/курага/чернослив 130г
121880,крупа рис голд обраб паром,Агроальянс,True,Агроальянс,900г,,,Крупа Рис Голд обраб. паром 900г Агро-Альянс
101883,продукт молокосод сгущ с сах сгущенка с сах с араматом шоколад,Главпродукт,True,"ЗАО ""Верховский молочно-консервный завод""",250г,,,Продукт молокосод. сгущ. с сах. 250г «Сгущенка с сах. с араматом шоколад»  Главпродукт
129257,капуста по-корейски классическая,Не Бренд,True,"ООО ""Эхо""",1000г,,,Капуста по-корейски классическая «Белоручка» 1000г
119773,кальмар шинкованый сол/сушеный,Сухогруз,True,"ООО ""SnehkMaster""",70г,,пак.,"Кальмар шинкованый сол/сушеный, 70г Сухогруз пак."
80403,крупа рис отборный,Националь,True,"ООО""Ангстрем""",900г,,,Крупа Рис Отборный 900г Националь
56191,желудки куриные охл,Ярославский Бройлер,True,"ООО ""Ярославский Бройлер"", Россия",кг,,,Желудки куриные охл.Ярославский Бройлер. кг
200538,кофе зерно especialisimo арабика,О'КЕЙ,True,SURESTE PRODUCTOS HOSTELEROS,500г,100%,,Кофе ОКЕЙ зерно Especialisimo 100% Арабика 500г
168544,сельдь филе в масле традиционная,STANDARD,True,,240г,,,"Сельдь филе в масле Традиционная Любо есть, 240г VICI"
90296,яйцо куриное с1 халяль роскар,Не Бренд,,,,,10шт,Яйцо куриное С1 Халяль Роскар 10шт
46412,бедро цыпленка охл халяль,Приосколье,True,"ЗАО ""Приосколье"", Россия",кг,,,"Бедро цыпленка охл Халяль Приосколье, кг"
205614,крем творожный с кусочками зелени,Cremе Bonjour,True,ООО «Юнилевер Русь»,200г,,,Крем творожный Cremе Bonjour с кусочками зелени 200г
512391,сок active яблоко осв,Тонус,True,"""Лебедянский""",1.45л,,т/пак,Сок Тонус Active+ яблоко осв.1.45л т/пак
243736,сосиски сливочные,Рублёвский,True,"ООО ""Торговый дом ""Москворецкий""",480г,,,Сосиски Сливочные Рублёвский 480г
570461,уксус винный бальзам из модена,Borges,True,ACEITES BORGES,250мл,,,Уксус Borges винный бальзам из Модена 250мл
579326,вода пит газ,Калинов Родник,True,"ООО ""Фонте Аква""",0.5л,,пэт,Вода Калинов Родник пит.газ.0.5л ПЭТ
244080,пирожные заварные кольца,Фили-Бейкер,True,"ООО ""Фили-Бейкер""",300г,,,"Пирожные заварные ""Кольца"" Фили-Бейкер 300г"
168653,мороженое эскимо пломбир в шоколадной глазури,Сваля,True,"АО ""Пено Жвайгждес""",80г,,,Мороженое эскимо пломбир в шоколадной глазури 80г Сваля
93502,рис ризотто с грибами т/ст,Домашнее БИСТРО,True,"ООО ""Си-Проджект""",60г,,,Рис Дом.Бистро ризотто с грибами 60г т/ст
117024,рассол для грудинки копченой,Костровок,True,,150г,,,Рассол для грудинки копченой 150г Идея на закуску
592431,сок мультифрукт,Золотая Русь,True,"ОАО ""Сады Придонья"", Россия",0.2л,,ст/б,Сок Золотая Русь мультифрукт 0.2л ст/б
92642,пицца ассорти,О'КЕЙ,True,"ООО ""Морозко""",450г,,,Пицца ОКЕЙ ассорти  450г
44060,колбаса в/к сервелат финский,Мясная империя,True,"ООО ""МПК Мясная империя""",кг,,,Колбаса в/к Сервелат Финский Мясная Империя. кг
241562,подсластитель,Milford,True,,39г,,650 таб,Подсластитель Milford 650 таб 39г
244867,мороженое пломбир шоколадный с кусочками шоколада,Окей,True,"ООО ""Талосто-3000""",450г,,,Мороженое ОКЕЙ пломбир шоколадный с  кусочками шоколада 450г
598068,сыр голландский,Ичалки,True,"ОАО ""Сыродельный Комбинат Ичалковский""",фасовка 300 г,45%,,Сыр Голландский Ичалки 45% фасовка 300 г
44383,огурцы,Не Бренд,,,кг,,,"Огурцы, кг"
114801,икра из молодых баклажанов обломов,Пиканта,,"ООО ""Плодородный край""",420г,,,Икра из молодых баклажанов 420г Обломов
43466,карпаччо из мяса птицы с/к,СЕТУНЬ,True,"ООО' МПЗ ""Сетунь""",1кг,,,Карпаччо из мяса птицы с/к 1кг Сетунь
47125,бекон в/к в/с,Царицыно,True,"ОАО ""Фирменный Торговый Дом Царицыно""",кг,,в/у,Бекон в/к в/с в/у Царицыно. кг
242345,круассаны,Морозко,True,"ООО ""Морозко""",140г,,2шт,Круассаны 2шт 140г Морозко
112703,сметана,Домик в деревне,True,"ОАО ""Вимм-Билль-Данн""",180г,15%,стакан,Сметана Домик в деревне 15% 180г стакан
135639,зефир с ароматом ванили,PL NoName,True,"ООО ""КФ Тореро""",220г,,,Зефир с ароматом ванили 220г PL FP
594239,майонез оливковый сашет,Ряба,True,"ОАО ""Нижегородский масло-жировой комбинат""",233г,67%,,Майонез Ряба оливковый 67% 233г сашет
243799,сардельки,Доктор,True,"ОАО ""Царицыно""",400г,,,Сардельки Доктор 400г
205972,оливки зел б/к,Lutik,True,Hamamacioglu Koll Sti,370г,,,Оливки зел б/к 370г Lutik
198359,крекеры без соли,Delser,True,,200г,,,Крекеры Дельсер без соли 200г
104825,приправа розмарин,Добрый гном,True,"ООО ""КАРЕ""",10г,,,Приправа Добрый гном Розмарин 10г
161894,вареники с вишней,Не Бренд,True,"ООО ""Айс-Продукт""",450г,,,Вареники с вишней 450г От Ильиной
204604,кетчуп томат 0 57,Heinz,True,"ООО ""Петропродукт - Отрадное""",,,п/э,Кетчуп HEINZ Томат.п/э 0.57
206154,опята отборные в маринаде,Lutik,True,Xiamen Ovisen I/E Co. Ltd,200г,,,Опята отборные Lutik в маринаде 200г
243843,ассорти брауншвейгская сервелат с/к,ДЫМОВ,True,"ООО""Дымовское колбасное производство""",90г,,нарезка,Ассорти Брауншвейгская + Сервелат с/к ДЫМОВ нарезка 90г
614794,круассан клубника 3 1,7 Days,True,,65гр,,,Круассан  7 Days  клубника 65гр (3+1)
121761,лепешка восточная сырная,НИЖЕГОРОДСКИЙ ХЛЕБ,,НИЖЕГОРОДСКИЙ ХЛЕБ,300г,,,Лепешка Восточная сырная 300г
47906,огузок говяжий охл халяль эколь,Не Бренд,,,кг,,,"Огузок говяжий охл Халяль Эколь, кг"
241796,биойогурт обог б/б слива злаки,Активиа,True,"ООО ""Данон Индустрия""",290г,2%,,Биойогурт обог.б/б Активия 2% 290г слива+злаки
46303,стерлядь с/г непотр охл,Не Бренд,,,кг,,,"Стерлядь с/г непотр. охл., кг"
92771,блинчики с картофелем и грибами,Морозко,True,"ООО ""Морозко""",3штх70г,,,Блинчики с картофелем и грибами Морозко 3штх70г
46789,филе цыпленка зам,Приосколье,True,,кг,,,"Филе цыпленка зам. Приосколье,кг"
594632,молоко пастер фп,Дмитровский молочный завод,True,"ОАО ""Дмитровский Молочный Завод""",0.9л,3.2%,,Молоко пастер Дмитровский МЗ 3.2% 0.9л ФП
520950,майонезный соус провансаль,Полонез,True,"ООО ""Ногинский пищевой комбинат""",220мл,20%,дой-пак,Майонезный соус Полонез провансаль 20% 220мл дой-пак
182276,приправа для кофе и десертов мельница,Kamis,True,McCormick Polska S.A.,48г,,,Приправа Kamis для кофе и десертов 48г мельница
90233,желе вишня,Русский продукт,True,"ОАО ""Русский продукт""",50г,,,Желе Русский Продукт Вишня 50г
84284,крупа рис обработанный паром,Макфа,True,"ОАО ""МАКФА""",800г,,,Крупа Рис обработанный паром 800г Макфа
601988,майонез с лим соком дой,Слобода,True,"ОАО ""ЭФКО""",400мл,67%,пак,Майонез Слобода с лим соком 67% 400мл дой пак
110286,салат олимп,Не Бренд,True,,150г,,уп,"Салат Олимп ""Белая Дача"" 150г, уп"
106089,сосиски докторские,О'КЕЙ,True,"ЗАО ""Микояновский мясокомбинат""",400г,,,Сосиски ОКЕЙ Докторские 400г
49927,цыпленок табака охл,Не Бренд,True,"ОАО ""Птицефабрика Калужская"", Россия",кг,,,"Цыпленок табака охл. Рококо, кг"
195381,кофе растворимый с доб молотого милликано,Jacobs,True,"ООО ""Мон'дэлис Русь""",75г,,пакет,Кофе растворимый с доб. молотого Якобс Монарх Милликано75г пакет
313299,вода мин прир газ лечеб-стол,Нарзан,True,"ОАО ""Нарзан""",1.8л,,пэт,Вода Нарзан мин.прир.газ.лечеб-стол.1.8л ПЭТ
87247,крупа пшеничная булгур,Мистраль,True,"ООО ""Мистраль Трейдинг""",500г,,,Крупа Пшеничная Булгур 500г Мистраль
155832,фисташки жареные соленые,Твердый знак,True,"ЗАО ""ОРЕХПРОМ""",250г,,,Фисташки жареные соленые Твердый знак 250г
123031,сыр русская моцарелла с укропом и чесноком,GRANABELLA,True,"ОАО ""Маслодельно-сыродельный комбинат ""Михайловский"", Россия",300г,40%,,"Сыр ""Русская Моцарелла "" с укропом и чесноком GRANABELLA. 40%. 300г"
195224,конфеты,Cote D'or,True,Шварцкопф & Хенкель Продакшен Юроп ГмбХ & Ко,150г,,,Конфеты Кот Дор 150г
